グラフにおいて、無リスク利子率 $R_F$ と投資対象 $A$ を結ぶ直線の「傾き」がシャープ・レシオに相当します。傾きが急であるほど、同じリスクに対して{{c1::高いリターン}}を得ている「{{c2::効率の良い運用}}」と判断されます。	[Definition] シャープ・レシオの傾きの意味
シャープ・レシオは、市場インデックス（ベンチマーク）と比較するのではなく、その投資対象{{c1::単体}}の{{c2::リスクとリターンのバランス}}を評価します。	[Definition] シャープ・レシオの評価対象
効率的市場仮説の下では、すべての投資家が目指すべき最大のシャープ・レシオは{{c1::CMLの傾き}}に一致します。	[Definition] シャープ・レシオとCMLの関係
シャープ・レシオの分母は {{c1::標準偏差 ($oldsymbol{\sigma}$)}} です。これは{{c2::分散投資が不十分なポートフォリオ}}や、{{c3::個別資産の評価}}に適しています。	[Contrast] シャープ・レシオの分母と適用
トレイナー・レシオの分母は {{c1::ベータ ($oldsymbol{\beta}$)}} です。これは{{c2::分散投資が十分になされたポートフォリオの評価}}に適しています。	[Contrast] トレイナー・レシオの分母と適用
シャープ・レシオは「システマティック・リスク」と「アンシステマティック・リスク」の{{c1::両方}}を含んだ {{c2::総リスク}} でリターンを割ります。そのため、{{c3::固有リスクを抱えた運用}}の評価に威力を発揮します。	[Definition] シャープ・レシオの分母が「総リスク」であることの意味
シャープ・レシオは収益率の分布が{{c1::正規分布}}であることを前提としているため、オプションを含むような「歪んだ」分布の評価には{{c2::適さない}}場合があります。	[Definition] シャープ・レシオの限界（正規分布前提）
シャープ・レシオは、分子がマイナス（リターンが $R_F$ を下回る）の場合、{{c1::数値の解釈が困難になる}}という欠点があります。	[Definition] シャープ・レシオの限界（分子がマイナスの場合）
複数のファンドのデータが与えられ「最も優れた運用はどれか」を問う計算問題では、シャープ・レシオの公式に当てはめて数値を出し、{{c1::数値が最も大きいもの}}を選びます。	[Sequential] シャープ・レシオを用いた順位付け問題の解法
